annotation_id,annotation_name,annotation_description,size,linkout,date_download,go_download_link
GO:0008677,2-dehydropantoate 2-reductase activity,"Catalysis of the reaction: (R)-pantoate + NADP+ = 2-dehydropantoate + H+ + NADPH. [EC:1.1.1.169, RHEA:16233]",3,http://amigo.geneontology.org/amigo/term/GO:0008677,2023-05-10,http://ftp.ebi.ac.uk/pub/databases/GO/goa/YEAST/goa_yeast.gaf.gz
GO:0017056,structural constituent of nuclear pore,"The action of a molecule that contributes to the structural integrity of the nuclear pore complex, a protein-lined channel in the nuclear envelope that allows the transfer of macromolecules. [GOC:mah, PMID:25802992]",96,http://amigo.geneontology.org/amigo/term/GO:0017056,2023-05-10,http://ftp.ebi.ac.uk/pub/databases/GO/goa/YEAST/goa_yeast.gaf.gz
GO:0008168,methyltransferase activity,Catalysis of the transfer of a methyl group to an acceptor molecule. [ISBN:0198506732],11,http://amigo.geneontology.org/amigo/term/GO:0008168,2023-05-10,http://ftp.ebi.ac.uk/pub/databases/GO/goa/YEAST/goa_yeast.gaf.gz
GO:0034246,mitochondrial transcription factor activity,"Interacting with the mitochondrial promoter DNA to modulate transcription by the mitochondrial RNA polymerase. [GOC:txnOH-2018, PMID:18391175]",4,http://amigo.geneontology.org/amigo/term/GO:0034246,2023-05-10,http://ftp.ebi.ac.uk/pub/databases/GO/goa/YEAST/goa_yeast.gaf.gz
GO:0042826,histone deacetylase binding,Binding to histone deacetylase. [GOC:jl],5,http://amigo.geneontology.org/amigo/term/GO:0042826,2023-05-10,http://ftp.ebi.ac.uk/pub/databases/GO/goa/YEAST/goa_yeast.gaf.gz
GO:0004801,transaldolase activity,"Catalysis of the reaction: sedoheptulose 7-phosphate + D-glyceraldehyde 3-phosphate = D-erythrose 4-phosphate + D-fructose 6-phosphate. [PMID:7592346, RHEA:17053]",4,http://amigo.geneontology.org/amigo/term/GO:0004801,2023-05-10,http://ftp.ebi.ac.uk/pub/databases/GO/goa/YEAST/goa_yeast.gaf.gz
GO:0004824,lysine-tRNA ligase activity,Catalysis of the reaction: ATP + L-lysine + tRNA(Lys) = AMP + diphosphate + L-lysyl-tRNA(Lys). [EC:6.1.1.6],6,http://amigo.geneontology.org/amigo/term/GO:0004824,2023-05-10,http://ftp.ebi.ac.uk/pub/databases/GO/goa/YEAST/goa_yeast.gaf.gz
GO:0003876,AMP deaminase activity,Catalysis of the reaction: AMP + H2O = IMP + NH3. [EC:3.5.4.6],3,http://amigo.geneontology.org/amigo/term/GO:0003876,2023-05-10,http://ftp.ebi.ac.uk/pub/databases/GO/goa/YEAST/goa_yeast.gaf.gz
GO:0015124,allantoate transmembrane transporter activity,"Enables the transfer of allantoate from one side of a membrane to the other. Allantoate is the end product of purine metabolism in mammals and some fish, formed form allantoin. It is widely distributed in plants as an important source of stored nitrogen. [GOC:ai, ISBN:0198547684]",3,http://amigo.geneontology.org/amigo/term/GO:0015124,2023-05-10,http://ftp.ebi.ac.uk/pub/databases/GO/goa/YEAST/goa_yeast.gaf.gz
GO:0071916,dipeptide transmembrane transporter activity,Enables the transfer of a dipeptide from one side of a membrane to the other. A dipeptide is a combination of two amino acids linked together by a peptide (-CO-NH-) bond. [GOC:mah],6,http://amigo.geneontology.org/amigo/term/GO:0071916,2023-05-10,http://ftp.ebi.ac.uk/pub/databases/GO/goa/YEAST/goa_yeast.gaf.gz
GO:0015175,neutral L-amino acid transmembrane transporter activity,"Enables the transfer of neutral L-amino acids from one side of a membrane to the other. Neutral amino acids have side chains with no charge at pH 7.3. [GOC:ai, GOC:mtg_transport, ISBN:0815340729]",1,http://amigo.geneontology.org/amigo/term/GO:0015175,2023-05-10,http://ftp.ebi.ac.uk/pub/databases/GO/goa/YEAST/goa_yeast.gaf.gz
GO:0015193,L-proline transmembrane transporter activity,"Enables the transfer of L-proline from one side of a membrane to the other. L-proline is pyrrolidine-2-carboxylic acid. [GOC:ai, GOC:mtg_transport, ISBN:0815340729]",5,http://amigo.geneontology.org/amigo/term/GO:0015193,2023-05-10,http://ftp.ebi.ac.uk/pub/databases/GO/goa/YEAST/goa_yeast.gaf.gz
GO:0008296,3'-5'-DNA exonuclease activity,Catalysis of the sequential cleavage of mononucleotides from a free 3' terminus of a DNA molecule. [GOC:mah],7,http://amigo.geneontology.org/amigo/term/GO:0008296,2023-05-10,http://ftp.ebi.ac.uk/pub/databases/GO/goa/YEAST/goa_yeast.gaf.gz
GO:0003725,double-stranded RNA binding,Binding to double-stranded RNA. [GOC:jl],7,http://amigo.geneontology.org/amigo/term/GO:0003725,2023-05-10,http://ftp.ebi.ac.uk/pub/databases/GO/goa/YEAST/goa_yeast.gaf.gz
GO:0004694,eukaryotic translation initiation factor 2alpha kinase activity,"Catalysis of the reaction: ATP + [eukaryotic translation initiation factor 2 alpha subunit] = ADP + [eukaryotic translation initiation factor 2 alpha subunit] phosphate. [GOC:mah, InterPro:IPR015516]",5,http://amigo.geneontology.org/amigo/term/GO:0004694,2023-05-10,http://ftp.ebi.ac.uk/pub/databases/GO/goa/YEAST/goa_yeast.gaf.gz
GO:0004860,protein kinase inhibitor activity,"Binds to and stops, prevents or reduces the activity of a protein kinase. [GOC:ai]",5,http://amigo.geneontology.org/amigo/term/GO:0004860,2023-05-10,http://ftp.ebi.ac.uk/pub/databases/GO/goa/YEAST/goa_yeast.gaf.gz
GO:0043023,ribosomal large subunit binding,Binding to a large ribosomal subunit. [GOC:go_curators],14,http://amigo.geneontology.org/amigo/term/GO:0043023,2023-05-10,http://ftp.ebi.ac.uk/pub/databases/GO/goa/YEAST/goa_yeast.gaf.gz
GO:0004385,guanylate kinase activity,Catalysis of the reaction: ATP + GMP = ADP + GDP. [EC:2.7.4.8],5,http://amigo.geneontology.org/amigo/term/GO:0004385,2023-05-10,http://ftp.ebi.ac.uk/pub/databases/GO/goa/YEAST/goa_yeast.gaf.gz
GO:0004809,tRNA (guanine-N2-)-methyltransferase activity,Catalysis of the reaction: S-adenosyl-L-methionine + tRNA containing guanine = S-adenosyl-L-homocysteine + tRNA containing N2-methylguanine. [EC:2.1.1.32],10,http://amigo.geneontology.org/amigo/term/GO:0004809,2023-05-10,http://ftp.ebi.ac.uk/pub/databases/GO/goa/YEAST/goa_yeast.gaf.gz
GO:0008171,O-methyltransferase activity,Catalysis of the transfer of a methyl group to the oxygen atom of an acceptor molecule. [GOC:ai],3,http://amigo.geneontology.org/amigo/term/GO:0008171,2023-05-10,http://ftp.ebi.ac.uk/pub/databases/GO/goa/YEAST/goa_yeast.gaf.gz
GO:0008649,rRNA methyltransferase activity,Catalysis of the transfer of a methyl group from S-adenosyl-L-methionine to a nucleoside residue in an rRNA molecule. [GOC:mah],4,http://amigo.geneontology.org/amigo/term/GO:0008649,2023-05-10,http://ftp.ebi.ac.uk/pub/databases/GO/goa/YEAST/goa_yeast.gaf.gz
GO:1990259,histone H2AQ104 methyltransferase activity,Catalysis of the reaction: S-adenosyl-L-methionine + (histone H2A)-glutamine (position 104) = S-adenosyl-L-homocysteine + (histone H2A)-N5-methyl-glutamine (position 104). Note that this corresponds to  Q105 in yeast. [PMID:24352239],4,http://amigo.geneontology.org/amigo/term/GO:1990259,2023-05-10,http://ftp.ebi.ac.uk/pub/databases/GO/goa/YEAST/goa_yeast.gaf.gz
GO:0004127,cytidylate kinase activity,Catalysis of the reaction: ATP + (d)CMP = ADP + (d)CDP. [EC:2.7.4.14],1,http://amigo.geneontology.org/amigo/term/GO:0004127,2023-05-10,http://ftp.ebi.ac.uk/pub/databases/GO/goa/YEAST/goa_yeast.gaf.gz
GO:0033862,UMP kinase activity,Catalysis of the reaction: ATP + UMP = ADP + UDP. [EC:2.7.4.22],1,http://amigo.geneontology.org/amigo/term/GO:0033862,2023-05-10,http://ftp.ebi.ac.uk/pub/databases/GO/goa/YEAST/goa_yeast.gaf.gz
GO:0004338,"glucan exo-1,3-beta-glucosidase activity","Catalysis of the successive hydrolysis of beta-D-glucose units from the non-reducing ends of (1->3)-beta-D-glucans, releasing alpha-glucose. [EC:3.2.1.58]",8,http://amigo.geneontology.org/amigo/term/GO:0004338,2023-05-10,http://ftp.ebi.ac.uk/pub/databases/GO/goa/YEAST/goa_yeast.gaf.gz
GO:0008061,chitin binding,"Binding to chitin, a linear polysaccharide consisting of beta-(1->4)-linked N-acetyl-D-glucosamine residues. [GOC:jl, ISBN:0198506732]",5,http://amigo.geneontology.org/amigo/term/GO:0008061,2023-05-10,http://ftp.ebi.ac.uk/pub/databases/GO/goa/YEAST/goa_yeast.gaf.gz
GO:0042973,"glucan endo-1,3-beta-D-glucosidase activity",Catalysis of the hydrolysis of (1->3)-beta-D-glucosidic linkages in (1->3)-beta-D-glucans. [EC:3.2.1.39],12,http://amigo.geneontology.org/amigo/term/GO:0042973,2023-05-10,http://ftp.ebi.ac.uk/pub/databases/GO/goa/YEAST/goa_yeast.gaf.gz
GO:0030544,Hsp70 protein binding,"Binding to a Hsp70 protein, heat shock proteins around 70kDa in size. [ISBN:0198506732]",8,http://amigo.geneontology.org/amigo/term/GO:0030544,2023-05-10,http://ftp.ebi.ac.uk/pub/databases/GO/goa/YEAST/goa_yeast.gaf.gz
GO:0051879,Hsp90 protein binding,"Binding to Hsp90 proteins, any of a group of heat shock proteins around 90kDa in size. [GOC:ai]",7,http://amigo.geneontology.org/amigo/term/GO:0051879,2023-05-10,http://ftp.ebi.ac.uk/pub/databases/GO/goa/YEAST/goa_yeast.gaf.gz
GO:0008408,3'-5' exonuclease activity,Catalysis of the hydrolysis of ester linkages within nucleic acids by removing nucleotide residues from the 3' end. [GOC:ai],8,http://amigo.geneontology.org/amigo/term/GO:0008408,2023-05-10,http://ftp.ebi.ac.uk/pub/databases/GO/goa/YEAST/goa_yeast.gaf.gz
GO:0004325,ferrochelatase activity,Catalysis of the reaction: heme B (protoheme) + H+ = Fe(2+) + protoporphyrin IX. [RHEA:22584],4,http://amigo.geneontology.org/amigo/term/GO:0004325,2023-05-10,http://ftp.ebi.ac.uk/pub/databases/GO/goa/YEAST/goa_yeast.gaf.gz
GO:0043115,precorrin-2 dehydrogenase activity,"Catalysis of the reaction: NAD+ + precorrin-2 = 2 H+ + NADH + sirohydrochlorin. [EC:1.3.1.76, RHEA:15613]",3,http://amigo.geneontology.org/amigo/term/GO:0043115,2023-05-10,http://ftp.ebi.ac.uk/pub/databases/GO/goa/YEAST/goa_yeast.gaf.gz
GO:0051266,sirohydrochlorin ferrochelatase activity,Catalysis of the reaction: siroheme + 2 H+ = Fe(2+) + sirohydrochlorin. [RHEA:24360],2,http://amigo.geneontology.org/amigo/term/GO:0051266,2023-05-10,http://ftp.ebi.ac.uk/pub/databases/GO/goa/YEAST/goa_yeast.gaf.gz
GO:0030337,DNA polymerase processivity factor activity,"An enzyme regulator activity that increases the processivity of polymerization by DNA polymerase, by allowing the polymerase to move rapidly along DNA while remaining topologically bound to it. [GOC:mah, PMID:7903401, PMID:8087839]",8,http://amigo.geneontology.org/amigo/term/GO:0030337,2023-05-10,http://ftp.ebi.ac.uk/pub/databases/GO/goa/YEAST/goa_yeast.gaf.gz
GO:0000386,second spliceosomal transesterification activity,"Catalysis of the second transesterification reaction of spliceosomal mRNA splicing. Ligation of the two exons occurs via a transesterification reaction where the free 3'-hydroxyl group of the 5' exon is the nucleophile attacking the 3' splice site. Non-expressed sequences are now detached from the exons. In cis splicing, the intron is in a lariat structure. [GOC:krc, ISBN:0879695897, PMID:19239890]",14,http://amigo.geneontology.org/amigo/term/GO:0000386,2023-05-10,http://ftp.ebi.ac.uk/pub/databases/GO/goa/YEAST/goa_yeast.gaf.gz
GO:0034458,3'-5' RNA helicase activity,"Unwinding of an RNA helix in the 3' to 5' direction, driven by ATP hydrolysis. [GOC:jp]",6,http://amigo.geneontology.org/amigo/term/GO:0034458,2023-05-10,http://ftp.ebi.ac.uk/pub/databases/GO/goa/YEAST/goa_yeast.gaf.gz
GO:0004795,threonine synthase activity,Catalysis of the reaction: O-phospho-L-homoserine + H2O = L-threonine + phosphate. [EC:4.2.3.1],2,http://amigo.geneontology.org/amigo/term/GO:0004795,2023-05-10,http://ftp.ebi.ac.uk/pub/databases/GO/goa/YEAST/goa_yeast.gaf.gz
GO:0004739,pyruvate dehydrogenase (acetyl-transferring) activity,Catalysis of the reaction: pyruvate + lipoamide = S-acetyldihydrolipoamide + CO2. [EC:1.2.4.1],4,http://amigo.geneontology.org/amigo/term/GO:0004739,2023-05-10,http://ftp.ebi.ac.uk/pub/databases/GO/goa/YEAST/goa_yeast.gaf.gz
GO:1990446,U1 snRNP binding,Binding to a U1 small nuclear ribonucleoprotein particle. [PMID:14713954],1,http://amigo.geneontology.org/amigo/term/GO:1990446,2023-05-10,http://ftp.ebi.ac.uk/pub/databases/GO/goa/YEAST/goa_yeast.gaf.gz
GO:0033699,DNA 5'-adenosine monophosphate hydrolase activity,"Catalysis of the reaction: 5'-AMP-DNA + H2O = AMP + DNA; nucleophilic release of a covalently linked adenylate residue from a DNA strand, leaving a 5' phosphate terminus. [GOC:mah, PMID:16547001, PMID:17276982]",7,http://amigo.geneontology.org/amigo/term/GO:0033699,2023-05-10,http://ftp.ebi.ac.uk/pub/databases/GO/goa/YEAST/goa_yeast.gaf.gz
GO:0003877,ATP adenylyltransferase activity,"Catalysis of the reaction: ADP + ATP = phosphate + P(1),P(4)-bis(5'-adenosyl)tetraphosphate. [EC:2.7.7.53]",4,http://amigo.geneontology.org/amigo/term/GO:0003877,2023-05-10,http://ftp.ebi.ac.uk/pub/databases/GO/goa/YEAST/goa_yeast.gaf.gz
GO:0004780,sulfate adenylyltransferase (ADP) activity,"Catalysis of the reaction: ADP + H+ + sulfate = 5'-adenylyl sulfate + phosphate. [EC:2.7.7.5, RHEA:16529]",4,http://amigo.geneontology.org/amigo/term/GO:0004780,2023-05-10,http://ftp.ebi.ac.uk/pub/databases/GO/goa/YEAST/goa_yeast.gaf.gz
GO:0008796,bis(5'-nucleosyl)-tetraphosphatase activity,"Catalysis of the hydrolysis of P(1),P(4)-bis(5'-nucleosyl)tetraphosphate into two nucleotides. [GOC:ai]",10,http://amigo.geneontology.org/amigo/term/GO:0008796,2023-05-10,http://ftp.ebi.ac.uk/pub/databases/GO/goa/YEAST/goa_yeast.gaf.gz
GO:0003958,NADPH-hemoprotein reductase activity,Catalysis of the reaction: NADPH + H+ + n oxidized hemoprotein = NADP+ + n reduced hemoprotein. [EC:1.6.2.4],3,http://amigo.geneontology.org/amigo/term/GO:0003958,2023-05-10,http://ftp.ebi.ac.uk/pub/databases/GO/goa/YEAST/goa_yeast.gaf.gz
GO:0003959,NADPH dehydrogenase activity,Catalysis of the reaction: NADPH + H+ + acceptor = NADP+ + reduced acceptor. [RHEA:13149],6,http://amigo.geneontology.org/amigo/term/GO:0003959,2023-05-10,http://ftp.ebi.ac.uk/pub/databases/GO/goa/YEAST/goa_yeast.gaf.gz
GO:0010181,FMN binding,Binding to flavin mono nucleotide. Flavin mono nucleotide (FMN) is the coenzyme or the prosthetic group of various flavoprotein oxidoreductase enzymes. [GOC:tb],20,http://amigo.geneontology.org/amigo/term/GO:0010181,2023-05-10,http://ftp.ebi.ac.uk/pub/databases/GO/goa/YEAST/goa_yeast.gaf.gz
GO:0004057,arginyltransferase activity,Catalysis of the reaction: L-arginyl-tRNA + protein = tRNA + L-arginyl-protein. [EC:2.3.2.8],3,http://amigo.geneontology.org/amigo/term/GO:0004057,2023-05-10,http://ftp.ebi.ac.uk/pub/databases/GO/goa/YEAST/goa_yeast.gaf.gz
GO:0080025,"phosphatidylinositol-3,5-bisphosphate binding","Binding to phosphatidylinositol-3,5-bisphosphate, a derivative of phosphatidylinositol in which the inositol ring is phosphorylated at the 3' and 5' positions. [GOC:bf, PMID:18397324]",24,http://amigo.geneontology.org/amigo/term/GO:0080025,2023-05-10,http://ftp.ebi.ac.uk/pub/databases/GO/goa/YEAST/goa_yeast.gaf.gz
GO:0000213,tRNA-intron endonuclease activity,"Catalysis of the endonucleolytic cleavage of pre-tRNA, producing 5'-hydroxyl and 2',3'-cyclic phosphate termini, and specifically removing the intron. [EC:4.6.1.16]",11,http://amigo.geneontology.org/amigo/term/GO:0000213,2023-05-10,http://ftp.ebi.ac.uk/pub/databases/GO/goa/YEAST/goa_yeast.gaf.gz
GO:0016829,lyase activity,"Catalysis of the cleavage of C-C, C-O, C-N and other bonds by other means than by hydrolysis or oxidation, or conversely adding a group to a double bond. They differ from other enzymes in that two substrates are involved in one reaction direction, but only one in the other direction. When acting on the single substrate, a molecule is eliminated and this generates either a new double bond or a new ring. [ISBN:0198547684]",3,http://amigo.geneontology.org/amigo/term/GO:0016829,2023-05-10,http://ftp.ebi.ac.uk/pub/databases/GO/goa/YEAST/goa_yeast.gaf.gz
GO:0000030,mannosyltransferase activity,"Catalysis of the transfer of a mannosyl group to an acceptor molecule, typically another carbohydrate or a lipid. [GOC:ai, GOC:cjm]",21,http://amigo.geneontology.org/amigo/term/GO:0000030,2023-05-10,http://ftp.ebi.ac.uk/pub/databases/GO/goa/YEAST/goa_yeast.gaf.gz
GO:0004578,chitobiosyldiphosphodolichol beta-mannosyltransferase activity,Catalysis of the reaction: GDP-mannose + chitobiosyldiphosphodolichol = GDP + beta-D-mannosylchitobiosyldiphosphodolichol. [EC:2.4.1.142],2,http://amigo.geneontology.org/amigo/term/GO:0004578,2023-05-10,http://ftp.ebi.ac.uk/pub/databases/GO/goa/YEAST/goa_yeast.gaf.gz
GO:0019187,"beta-1,4-mannosyltransferase activity","Catalysis of the transfer of a mannose residue to an oligosaccharide, forming a beta-(1->4) linkage. [GOC:mcc, PMID:8166646]",1,http://amigo.geneontology.org/amigo/term/GO:0019187,2023-05-10,http://ftp.ebi.ac.uk/pub/databases/GO/goa/YEAST/goa_yeast.gaf.gz
GO:0003872,6-phosphofructokinase activity,"Catalysis of the reaction: ATP + D-fructose-6-phosphate = ADP + D-fructose 1,6-bisphosphate. [EC:2.7.1.11]",4,http://amigo.geneontology.org/amigo/term/GO:0003872,2023-05-10,http://ftp.ebi.ac.uk/pub/databases/GO/goa/YEAST/goa_yeast.gaf.gz
GO:0016208,AMP binding,"Binding to AMP, adenosine monophosphate. [GOC:go_curators]",6,http://amigo.geneontology.org/amigo/term/GO:0016208,2023-05-10,http://ftp.ebi.ac.uk/pub/databases/GO/goa/YEAST/goa_yeast.gaf.gz
GO:0070095,fructose-6-phosphate binding,Binding to fructose 6-phosphate. [GOC:mah],2,http://amigo.geneontology.org/amigo/term/GO:0070095,2023-05-10,http://ftp.ebi.ac.uk/pub/databases/GO/goa/YEAST/goa_yeast.gaf.gz
GO:0015212,cytidine transmembrane transporter activity,"Enables the transfer of cytidine, cytosine riboside, from one side of a membrane to the other. [GOC:go_curators]",2,http://amigo.geneontology.org/amigo/term/GO:0015212,2023-05-10,http://ftp.ebi.ac.uk/pub/databases/GO/goa/YEAST/goa_yeast.gaf.gz
GO:0070273,phosphatidylinositol-4-phosphate binding,"Binding to phosphatidylinositol-4-phosphate, a derivative of phosphatidylinositol in which the inositol ring is phosphorylated at the 4' position. [GOC:bf, GOC:mah]",30,http://amigo.geneontology.org/amigo/term/GO:0070273,2023-05-10,http://ftp.ebi.ac.uk/pub/databases/GO/goa/YEAST/goa_yeast.gaf.gz
GO:0019237,centromeric DNA binding,"Binding to a centromere, a region of chromosome where the spindle fibers attach during mitosis and meiosis. [GOC:jl, SO:0000577]",17,http://amigo.geneontology.org/amigo/term/GO:0019237,2023-05-10,http://ftp.ebi.ac.uk/pub/databases/GO/goa/YEAST/goa_yeast.gaf.gz
GO:0008569,minus-end-directed microtubule motor activity,"A motor activity that generates movement along a microtubule toward the minus end, driven by ATP hydrolysis. [GOC:mah, GOC:vw, PMID:15659646, PMID:32842864]",9,http://amigo.geneontology.org/amigo/term/GO:0008569,2023-05-10,http://ftp.ebi.ac.uk/pub/databases/GO/goa/YEAST/goa_yeast.gaf.gz
GO:0070034,telomerase RNA binding,"Binding to the telomerase RNA template. [GOC:krc, PMID:16884717]",8,http://amigo.geneontology.org/amigo/term/GO:0070034,2023-05-10,http://ftp.ebi.ac.uk/pub/databases/GO/goa/YEAST/goa_yeast.gaf.gz
GO:0015184,L-cystine transmembrane transporter activity,"Enables the transfer of L-cystine from one side of a membrane to the other. [GOC:go_curators, GOC:mtg_transport, ISBN:0198506732, ISBN:0815340729]",2,http://amigo.geneontology.org/amigo/term/GO:0015184,2023-05-10,http://ftp.ebi.ac.uk/pub/databases/GO/goa/YEAST/goa_yeast.gaf.gz
GO:0015293,symporter activity,"Enables the active transport of a solute across a membrane by a mechanism whereby two or more species are transported together in the same direction in a tightly coupled process not directly linked to a form of energy other than chemiosmotic energy. [GOC:mtg_transport, ISBN:0815340729, PMID:10839820]",6,http://amigo.geneontology.org/amigo/term/GO:0015293,2023-05-10,http://ftp.ebi.ac.uk/pub/databases/GO/goa/YEAST/goa_yeast.gaf.gz
GO:0004413,homoserine kinase activity,"Catalysis of the reaction: L-homoserine + ATP = O-phospho-L-homoserine + ADP + 2 H+. [EC:2.7.1.39, RHEA:13985]",1,http://amigo.geneontology.org/amigo/term/GO:0004413,2023-05-10,http://ftp.ebi.ac.uk/pub/databases/GO/goa/YEAST/goa_yeast.gaf.gz
GO:0004861,cyclin-dependent protein serine/threonine kinase inhibitor activity,"Binds to and stops, prevents or reduces the activity of a cyclin-dependent protein serine/threonine kinase. [GOC:mah, GOC:pr]",7,http://amigo.geneontology.org/amigo/term/GO:0004861,2023-05-10,http://ftp.ebi.ac.uk/pub/databases/GO/goa/YEAST/goa_yeast.gaf.gz
GO:0008081,phosphoric diester hydrolase activity,"Catalysis of the hydrolysis of a phosphodiester to give a phosphomonoester and a free hydroxyl group. [EC:3.1.4.-, GOC:curators]",6,http://amigo.geneontology.org/amigo/term/GO:0008081,2023-05-10,http://ftp.ebi.ac.uk/pub/databases/GO/goa/YEAST/goa_yeast.gaf.gz
GO:0030060,L-malate dehydrogenase activity,Catalysis of the reaction: (S)-malate + NAD+ = oxaloacetate + NADH + H+. [EC:1.1.1.37],10,http://amigo.geneontology.org/amigo/term/GO:0030060,2023-05-10,http://ftp.ebi.ac.uk/pub/databases/GO/goa/YEAST/goa_yeast.gaf.gz
GO:0003779,actin binding,"Binding to monomeric or multimeric forms of actin, including actin filaments. [GOC:clt]",27,http://amigo.geneontology.org/amigo/term/GO:0003779,2023-05-10,http://ftp.ebi.ac.uk/pub/databases/GO/goa/YEAST/goa_yeast.gaf.gz
GO:0008179,adenylate cyclase binding,Binding to an adenylate cyclase. [GOC:jl],2,http://amigo.geneontology.org/amigo/term/GO:0008179,2023-05-10,http://ftp.ebi.ac.uk/pub/databases/GO/goa/YEAST/goa_yeast.gaf.gz
GO:0003867,4-aminobutyrate transaminase activity,Catalysis of the reaction: 4-aminobutanoate + amino group acceptor = succinate semialdehyde + amino acid. [GOC:mah],2,http://amigo.geneontology.org/amigo/term/GO:0003867,2023-05-10,http://ftp.ebi.ac.uk/pub/databases/GO/goa/YEAST/goa_yeast.gaf.gz
GO:0034386,4-aminobutyrate:2-oxoglutarate transaminase activity,"Catalysis of the reaction: 4-aminobutanoate + 2-oxoglutarate = succinate semialdehyde + L-glutamate. [EC:2.6.1.19, GOC:mah]",1,http://amigo.geneontology.org/amigo/term/GO:0034386,2023-05-10,http://ftp.ebi.ac.uk/pub/databases/GO/goa/YEAST/goa_yeast.gaf.gz
GO:0004364,glutathione transferase activity,"Catalysis of the reaction: R-X + glutathione = H-X + R-S-glutathione. R may be an aliphatic, aromatic or heterocyclic group; X may be a sulfate, nitrile or halide group. [EC:2.5.1.18]",15,http://amigo.geneontology.org/amigo/term/GO:0004364,2023-05-10,http://ftp.ebi.ac.uk/pub/databases/GO/goa/YEAST/goa_yeast.gaf.gz
GO:0004602,glutathione peroxidase activity,Catalysis of the reaction: 2 glutathione + hydrogen peroxide = oxidized glutathione + 2 H2O. [EC:1.11.1.9],13,http://amigo.geneontology.org/amigo/term/GO:0004602,2023-05-10,http://ftp.ebi.ac.uk/pub/databases/GO/goa/YEAST/goa_yeast.gaf.gz
GO:0015036,disulfide oxidoreductase activity,Catalysis of the reaction: substrate with reduced sulfide groups = substrate with oxidized disulfide bonds. [GOC:curators],10,http://amigo.geneontology.org/amigo/term/GO:0015036,2023-05-10,http://ftp.ebi.ac.uk/pub/databases/GO/goa/YEAST/goa_yeast.gaf.gz
GO:0015038,glutathione disulfide oxidoreductase activity,Catalysis of the reaction: 2 glutathione + electron acceptor = glutathione disulfide + electron donor. [GOC:mah],4,http://amigo.geneontology.org/amigo/term/GO:0015038,2023-05-10,http://ftp.ebi.ac.uk/pub/databases/GO/goa/YEAST/goa_yeast.gaf.gz
GO:0032050,clathrin heavy chain binding,Binding to a clathrin heavy chain. [GOC:mah],3,http://amigo.geneontology.org/amigo/term/GO:0032050,2023-05-10,http://ftp.ebi.ac.uk/pub/databases/GO/goa/YEAST/goa_yeast.gaf.gz
GO:0004142,diacylglycerol cholinephosphotransferase activity,"Catalysis of the reaction: CDP-choline + 1,2-diacylglycerol = CMP + a phosphatidylcholine. [EC:2.7.8.2, RHEA:32939]",4,http://amigo.geneontology.org/amigo/term/GO:0004142,2023-05-10,http://ftp.ebi.ac.uk/pub/databases/GO/goa/YEAST/goa_yeast.gaf.gz
GO:0003756,protein disulfide isomerase activity,"Catalysis of the rearrangement of both intrachain and interchain disulfide bonds in proteins. [EC:5.3.4.1, GOC:vw, Wikipedia:Protein_disulfide-isomerase#Function]",21,http://amigo.geneontology.org/amigo/term/GO:0003756,2023-05-10,http://ftp.ebi.ac.uk/pub/databases/GO/goa/YEAST/goa_yeast.gaf.gz
GO:0015035,protein-disulfide reductase activity,Catalysis of the reaction: a protein with reduced sulfide groups = a protein with oxidized disulfide bonds. [PMID:7559385],18,http://amigo.geneontology.org/amigo/term/GO:0015035,2023-05-10,http://ftp.ebi.ac.uk/pub/databases/GO/goa/YEAST/goa_yeast.gaf.gz
GO:0004604,phosphoadenylyl-sulfate reductase (thioredoxin) activity,"Catalysis of the reaction: adenosine 3',5'-diphosphate + H+ + sulfite + thioredoxin disulfide = 3'-phospho-5'-adenylyl sulfate + thioredoxin. Thioredoxin disulfide is the oxidized form of thioredoxin; 3'-phosphoadenosine 5'-phosphosulfate is also known as PAPS. [EC:1.8.4.8, RHEA:11724]",3,http://amigo.geneontology.org/amigo/term/GO:0004604,2023-05-10,http://ftp.ebi.ac.uk/pub/databases/GO/goa/YEAST/goa_yeast.gaf.gz
GO:0098624,3'-phosphoadenylylselenate reductase activity,"Catalysis of the reaction: 3'-phosphoadenylylselenate + NADPH => adenosine 3',5'-bisphosphate + selenite + NADP+ + H+. [PMID:14723223]",1,http://amigo.geneontology.org/amigo/term/GO:0098624,2023-05-10,http://ftp.ebi.ac.uk/pub/databases/GO/goa/YEAST/goa_yeast.gaf.gz
GO:0019888,protein phosphatase regulator activity,Binds to and modulates the activity of a protein phosphatase. [GOC:ai],30,http://amigo.geneontology.org/amigo/term/GO:0019888,2023-05-10,http://ftp.ebi.ac.uk/pub/databases/GO/goa/YEAST/goa_yeast.gaf.gz
GO:0045015,HDEL sequence binding,"Binding to a HDEL sequence, the C terminus tetrapeptide sequence His-Asp-Glu-Leu found in proteins that are to be retained in the endoplasmic reticulum. [PMID:1327759]",1,http://amigo.geneontology.org/amigo/term/GO:0045015,2023-05-10,http://ftp.ebi.ac.uk/pub/databases/GO/goa/YEAST/goa_yeast.gaf.gz
