annotation_id,annotation_name,annotation_description,size,linkout,date_download,go_download_link
GO:0001164,RNA polymerase I core promoter sequence-specific DNA binding,"Binding to a regulatory region composed of the transcription start site and binding sites for transcription factors of the RNA polymerase I transcription machinery. This site is often referred to as the CORE element. In mammalian cells, the CORE element functions in conjunction with the Upstream Control Element (UCE), while in fungi, protozoa, and plants, the CORE element functions without a UCE. [GOC:txnOH, PMID:12865296, PMID:14969726, PMID:8057832]",7,http://amigo.geneontology.org/amigo/term/GO:0001164,2023-05-10,http://ftp.ebi.ac.uk/pub/databases/GO/goa/YEAST/goa_yeast.gaf.gz
GO:0003985,acetyl-CoA C-acetyltransferase activity,Catalysis of the reaction: 2 acetyl-CoA = CoA + acetoacetyl-CoA. [EC:2.3.1.9],3,http://amigo.geneontology.org/amigo/term/GO:0003985,2023-05-10,http://ftp.ebi.ac.uk/pub/databases/GO/goa/YEAST/goa_yeast.gaf.gz
GO:0005519,cytoskeletal regulatory protein binding,"Binding to a protein involved in modulating the reorganization of the cytoskeleton. [GOC:go_curators, PMID:15163540]",2,http://amigo.geneontology.org/amigo/term/GO:0005519,2023-05-10,http://ftp.ebi.ac.uk/pub/databases/GO/goa/YEAST/goa_yeast.gaf.gz
GO:0008682,3-demethoxyubiquinol 3-hydroxylase activity,"Catalysis of the reaction: a 6-methoxy-3-methyl-2-all-trans-polyprenyl-1,4-benzoquinol + AH2 + O2 = A + a 3-demethylubiquinol + H2O. [RHEA:50908]",1,http://amigo.geneontology.org/amigo/term/GO:0008682,2023-05-10,http://ftp.ebi.ac.uk/pub/databases/GO/goa/YEAST/goa_yeast.gaf.gz
GO:0016709,"oxidoreductase activity, acting on paired donors, with incorporation or reduction of molecular oxygen, NAD(P)H as one donor, and incorporation of one atom of oxygen","Catalysis of an oxidation-reduction (redox) reaction in which hydrogen or electrons are transferred from NADH or NADPH and one other donor, and one atom of oxygen is incorporated into one donor. [GOC:mah]",2,http://amigo.geneontology.org/amigo/term/GO:0016709,2023-05-10,http://ftp.ebi.ac.uk/pub/databases/GO/goa/YEAST/goa_yeast.gaf.gz
GO:0120013,lipid transfer activity,"Removes a lipid from a membrane or a monolayer lipid particle, transports it through the aqueous phase while protected in a hydrophobic pocket, and brings it to an acceptor membrane or lipid particle. This results in intermembrane transfer of lipids. [GOC:krc, PMID:20823909, PMID:24220498, PMID:25797198]",3,http://amigo.geneontology.org/amigo/term/GO:0120013,2023-05-10,http://ftp.ebi.ac.uk/pub/databases/GO/goa/YEAST/goa_yeast.gaf.gz
GO:0016429,tRNA (adenine-N1-)-methyltransferase activity,Catalysis of the reaction: S-adenosyl-L-methionine + tRNA = S-adenosyl-L-homocysteine + tRNA containing N1-methyladenine. [EC:2.1.1.36],3,http://amigo.geneontology.org/amigo/term/GO:0016429,2023-05-10,http://ftp.ebi.ac.uk/pub/databases/GO/goa/YEAST/goa_yeast.gaf.gz
GO:0018548,pentaerythritol trinitrate reductase activity,Catalysis of the reaction: pentaerythritol trinitrate + NADPH = NADP+ + nitrate + pentaerythritol dinitrate. [UM-BBD_reactionID:r0025],2,http://amigo.geneontology.org/amigo/term/GO:0018548,2023-05-10,http://ftp.ebi.ac.uk/pub/databases/GO/goa/YEAST/goa_yeast.gaf.gz
GO:0004864,protein phosphatase inhibitor activity,"Binds to and stops, prevents or reduces the activity of a protein phosphatase. [GOC:ai]",7,http://amigo.geneontology.org/amigo/term/GO:0004864,2023-05-10,http://ftp.ebi.ac.uk/pub/databases/GO/goa/YEAST/goa_yeast.gaf.gz
GO:0000179,"rRNA (adenine-N6,N6-)-dimethyltransferase activity","Catalysis of the dimethylation of two adjacent adenine residues in a rRNA, using S-adenosyl-L-methionine as a methyl donor. [ISBN:1555811337, PMID:10690410]",3,http://amigo.geneontology.org/amigo/term/GO:0000179,2023-05-10,http://ftp.ebi.ac.uk/pub/databases/GO/goa/YEAST/goa_yeast.gaf.gz
GO:0052909,18S rRNA (adenine(1779)-N(6)/adenine(1780)-N(6))-dimethyltransferase activity,Catalysis of the reaction: 4 S-adenosyl-L-methionine + adenine(1779)/adenine(1780) in 18S rRNA = 4 S-adenosyl-L-homocysteine + N(6)-dimethyladenine(1779)/N(6)-dimethyladenine(1780) in 18S rRNA. [RHEA:42780],2,http://amigo.geneontology.org/amigo/term/GO:0052909,2023-05-10,http://ftp.ebi.ac.uk/pub/databases/GO/goa/YEAST/goa_yeast.gaf.gz
GO:0005262,calcium channel activity,"Enables the facilitated diffusion of a calcium ion (by an energy-independent process) involving passage through a transmembrane aqueous pore or channel without evidence for a carrier-mediated mechanism. [GOC:mtg_transport, GOC:pr, ISBN:0815340729]",5,http://amigo.geneontology.org/amigo/term/GO:0005262,2023-05-10,http://ftp.ebi.ac.uk/pub/databases/GO/goa/YEAST/goa_yeast.gaf.gz
GO:0015275,"stretch-activated, monoatomic cation-selective, calcium channel activity",Enables the transmembrane transfer of a calcium ion by a channel that opens in response to a mechanical stress in the form of stretching. [GOC:mtg_transport],1,http://amigo.geneontology.org/amigo/term/GO:0015275,2023-05-10,http://ftp.ebi.ac.uk/pub/databases/GO/goa/YEAST/goa_yeast.gaf.gz
GO:0001734,mRNA (N6-adenosine)-methyltransferase activity,"Catalysis of the reaction: S-adenosyl-L-methionine + RRACH = S-adenosyl-L-homocysteine + RRm6ACH; R is a purine, and H is C, A, or U. [GOC:hjd]",2,http://amigo.geneontology.org/amigo/term/GO:0001734,2023-05-10,http://ftp.ebi.ac.uk/pub/databases/GO/goa/YEAST/goa_yeast.gaf.gz
GO:0004417,hydroxyethylthiazole kinase activity,"Catalysis of the reaction: 5-(2-hydroxyethyl)-4-methylthiazole + ATP = 4-methyl-5-(2-phosphoethyl)-thiazole + ADP + 2 H+. [EC:2.7.1.50, RHEA:24212]",1,http://amigo.geneontology.org/amigo/term/GO:0004417,2023-05-10,http://ftp.ebi.ac.uk/pub/databases/GO/goa/YEAST/goa_yeast.gaf.gz
GO:0004789,thiamine-phosphate diphosphorylase activity,"Catalysis of the reaction: 4-amino-2-methyl-5-diphosphomethylpyrimidine + 4-methyl-5-(2-phosphoethyl)-thiazole + H+ = diphosphate + thiamine phosphate. [EC:2.5.1.3, RHEA:22328]",2,http://amigo.geneontology.org/amigo/term/GO:0004789,2023-05-10,http://ftp.ebi.ac.uk/pub/databases/GO/goa/YEAST/goa_yeast.gaf.gz
GO:0001096,TFIIF-class transcription factor complex binding,"Binding to a general RNA polymerase II transcription factor belonging to the TFIIF complex, one of the factors involved in formation of the preinitiation complex (PIC) by RNA polymerase II. [GOC:krc, PMID:16858867]",1,http://amigo.geneontology.org/amigo/term/GO:0001096,2023-05-10,http://ftp.ebi.ac.uk/pub/databases/GO/goa/YEAST/goa_yeast.gaf.gz
GO:0016290,palmitoyl-CoA hydrolase activity,Catalysis of the reaction: palmitoyl-CoA + H2O = CoA + palmitate. [EC:3.1.2.2],2,http://amigo.geneontology.org/amigo/term/GO:0016290,2023-05-10,http://ftp.ebi.ac.uk/pub/databases/GO/goa/YEAST/goa_yeast.gaf.gz
GO:0102991,myristoyl-CoA hydrolase activity,"Catalysis of the reaction: myristoyl-CoA + H2O <=> H+ + tetradecanoate + coenzyme A. [EC:3.1.2.2, GOC:pz]",1,http://amigo.geneontology.org/amigo/term/GO:0102991,2023-05-10,http://ftp.ebi.ac.uk/pub/databases/GO/goa/YEAST/goa_yeast.gaf.gz
GO:0047952,glycerol-3-phosphate dehydrogenase [NAD(P)+] activity,Catalysis of the reaction: sn-glycerol 3-phosphate + NAD(P)+ = glycerone phosphate + NAD(P)H + H+. [EC:1.1.1.94],2,http://amigo.geneontology.org/amigo/term/GO:0047952,2023-05-10,http://ftp.ebi.ac.uk/pub/databases/GO/goa/YEAST/goa_yeast.gaf.gz
GO:0000319,sulfite transmembrane transporter activity,Enables the transfer of sulfite ions from one side of a membrane to the other. [GOC:as],2,http://amigo.geneontology.org/amigo/term/GO:0000319,2023-05-10,http://ftp.ebi.ac.uk/pub/databases/GO/goa/YEAST/goa_yeast.gaf.gz
GO:0004475,mannose-1-phosphate guanylyltransferase (GTP) activity,Catalysis of the reaction: alpha-D-mannose 1-phosphate + GTP = diphosphate + GDP-alpha-D-mannose. [RHEA:15229],3,http://amigo.geneontology.org/amigo/term/GO:0004475,2023-05-10,http://ftp.ebi.ac.uk/pub/databases/GO/goa/YEAST/goa_yeast.gaf.gz
GO:0004856,xylulokinase activity,"Catalysis of the reaction: D-xylulose + ATP = D-xylulose 5-phosphate + ADP + 2 H+. [EC:2.7.1.17, RHEA:10964]",2,http://amigo.geneontology.org/amigo/term/GO:0004856,2023-05-10,http://ftp.ebi.ac.uk/pub/databases/GO/goa/YEAST/goa_yeast.gaf.gz
GO:0008810,cellulase activity,"Catalysis of the endohydrolysis of (1->4)-beta-D-glucosidic linkages in cellulose, lichenin and cereal beta-D-glucans. [EC:3.2.1.4]",1,http://amigo.geneontology.org/amigo/term/GO:0008810,2023-05-10,http://ftp.ebi.ac.uk/pub/databases/GO/goa/YEAST/goa_yeast.gaf.gz
GO:0015369,calcium:proton antiporter activity,"Enables the transfer of a solute or solutes from one side of a membrane to the other according to the reaction: Ca2+(in) + H+(out) = Ca2+(out) + H+(in). [RHEA:71799, TC:2.A.19.2.-]",6,http://amigo.geneontology.org/amigo/term/GO:0015369,2023-05-10,http://ftp.ebi.ac.uk/pub/databases/GO/goa/YEAST/goa_yeast.gaf.gz
GO:0015385,sodium:proton antiporter activity,"Enables the transfer of a solute or solutes from one side of a membrane to the other according to the reaction: Na+(out) + H+(in) = Na+(in) + H+(out). [TC:2.A.35.1.1, TC:2.A.36.-.-]",6,http://amigo.geneontology.org/amigo/term/GO:0015385,2023-05-10,http://ftp.ebi.ac.uk/pub/databases/GO/goa/YEAST/goa_yeast.gaf.gz
GO:0008474,palmitoyl-(protein) hydrolase activity,Catalysis of the reaction: palmitoyl-protein + H2O = palmitate + protein. [EC:3.1.2.22],4,http://amigo.geneontology.org/amigo/term/GO:0008474,2023-05-10,http://ftp.ebi.ac.uk/pub/databases/GO/goa/YEAST/goa_yeast.gaf.gz
GO:0106344,4-amino-5-hydroxymethyl-2-methylpyrimidine phosphate synthase activity from histidine and PLP,"Catalysis of the reaction: 2 Fe(3+) + 4 H2O + L-histidyl-[4-amino-5-hydroxymethyl-2-methylpyrimidine phosphate synthase] + N(6)-(pyridoxal phosphate)-L-lysyl-[4-amino-5-hydroxymethyl-2-methylpyrimidine phosphate synthase] = (2S)-2-amino-5-hydroxy-4-oxopentanoyl-[4-amino-5-hydroxymethyl-2-methylpyrimidine phosphate synthase] + 3-oxopropanoate + 4-amino-2-methyl-5-(phosphooxymethyl)pyrimidine + 2 Fe(2+) + 2 H+ + L-lysyl-[4-amino-5-hydroxymethyl-2-methylpyrimidine phosphate synthase]. [PMID:22568620, RHEA:65756]",4,http://amigo.geneontology.org/amigo/term/GO:0106344,2023-05-10,http://ftp.ebi.ac.uk/pub/databases/GO/goa/YEAST/goa_yeast.gaf.gz
GO:0036424,L-phosphoserine phosphatase activity,"Catalysis of the reaction: O-phospho-L-serine + H2O = L-serine + phosphate, on a free amino acid. [PMID:25037224, PMID:9188776, RHEA:21208]",2,http://amigo.geneontology.org/amigo/term/GO:0036424,2023-05-10,http://ftp.ebi.ac.uk/pub/databases/GO/goa/YEAST/goa_yeast.gaf.gz
GO:0003977,UDP-N-acetylglucosamine diphosphorylase activity,"Catalysis of the reaction: N-acetyl-alpha-D-glucosamine 1-phosphate + UTP = diphosphate + UDP-N-acetyl-alpha-D-glucosamine. [EC:2.7.7.23, RHEA:13509]",2,http://amigo.geneontology.org/amigo/term/GO:0003977,2023-05-10,http://ftp.ebi.ac.uk/pub/databases/GO/goa/YEAST/goa_yeast.gaf.gz
GO:0036381,pyridoxal 5'-phosphate synthase (glutamine hydrolysing) activity,"Catalysis of the reaction: D-ribose 5-phosphate + D-glyceraldehyde 3-phosphate + L-glutamine = pyridoxal 5'-phosphate + L-glutamate + 3 H2O + phosphate. The reaction occurs in two steps: L-glutamine + H2O = L-glutamate + NH3, and subsequently D-ribose 5-phosphate + D-glyceraldehyde 3-phosphate + NH3 = pyridoxal 5'-phosphate + 4 H2O + phosphate. [EC:4.3.3.6, GOC:rs]",10,http://amigo.geneontology.org/amigo/term/GO:0036381,2023-05-10,http://ftp.ebi.ac.uk/pub/databases/GO/goa/YEAST/goa_yeast.gaf.gz
GO:0016843,amine-lyase activity,"Catalysis of the release of amines by the cleavage of a carbon-nitrogen bond or the reverse reaction with an amine as a substrate. [EC:4.3.-.-, GOC:krc]",3,http://amigo.geneontology.org/amigo/term/GO:0016843,2023-05-10,http://ftp.ebi.ac.uk/pub/databases/GO/goa/YEAST/goa_yeast.gaf.gz
GO:0004371,glycerone kinase activity,"Catalysis of the reaction: ATP + glycerone = ADP + glycerone phosphate + 2 H+. [EC:2.7.1.29, RHEA:15773]",6,http://amigo.geneontology.org/amigo/term/GO:0004371,2023-05-10,http://ftp.ebi.ac.uk/pub/databases/GO/goa/YEAST/goa_yeast.gaf.gz
GO:0050354,triokinase activity,"Catalysis of the reaction: D-glyceraldehyde + ATP = D-glyceraldehyde 3-phosphate + ADP + 2 H+. [EC:2.7.1.28, RHEA:13941]",4,http://amigo.geneontology.org/amigo/term/GO:0050354,2023-05-10,http://ftp.ebi.ac.uk/pub/databases/GO/goa/YEAST/goa_yeast.gaf.gz
GO:0035650,AP-1 adaptor complex binding,"Binding to an AP-1 adaptor complex. The AP-1 adaptor complex is a heterotetrameric AP-type membrane coat adaptor complex that consists of beta1, gamma, mu1 and sigma1 subunits and links clathrin to the membrane surface of a vesicle. In at least humans, the AP-1 complex can be heterogeneric due to the existence of multiple subunit isoforms encoded by different genes (gamma1 and gamma2, mu1A and mu1B, and sigma1A, sigma1B and sigma1C). [PMID:21097499]",1,http://amigo.geneontology.org/amigo/term/GO:0035650,2023-05-10,http://ftp.ebi.ac.uk/pub/databases/GO/goa/YEAST/goa_yeast.gaf.gz
GO:0004760,serine-pyruvate transaminase activity,"Catalysis of the reaction: L-serine + pyruvate = 3-hydroxypyruvate + L-alanine. [EC:2.6.1.51, RHEA:22852]",1,http://amigo.geneontology.org/amigo/term/GO:0004760,2023-05-10,http://ftp.ebi.ac.uk/pub/databases/GO/goa/YEAST/goa_yeast.gaf.gz
GO:0008453,alanine-glyoxylate transaminase activity,Catalysis of the reaction: L-alanine + glyoxylate = pyruvate + glycine. [EC:2.6.1.44],3,http://amigo.geneontology.org/amigo/term/GO:0008453,2023-05-10,http://ftp.ebi.ac.uk/pub/databases/GO/goa/YEAST/goa_yeast.gaf.gz
GO:0019912,cyclin-dependent protein kinase activating kinase activity,Catalysis of the reaction: ATP + a protein = ADP + a phosphoprotein; increases the activity of a cyclin-dependent protein kinase (CDK). [GOC:go_curators],8,http://amigo.geneontology.org/amigo/term/GO:0019912,2023-05-10,http://ftp.ebi.ac.uk/pub/databases/GO/goa/YEAST/goa_yeast.gaf.gz
GO:0050185,phosphatidylinositol deacylase activity,"Catalysis of the reaction: 1-phosphatidyl-1D-myo-inositol + H2O = 1-acyl-sn-glycero-3-phospho-D-myo-inositol + a carboxylate + H+. [EC:3.1.1.52, RHEA:18001]",2,http://amigo.geneontology.org/amigo/term/GO:0050185,2023-05-10,http://ftp.ebi.ac.uk/pub/databases/GO/goa/YEAST/goa_yeast.gaf.gz
GO:0004343,glucosamine 6-phosphate N-acetyltransferase activity,"Catalysis of the reaction: D-glucosamine 6-phosphate + acetyl-CoA = N-acetyl-D-glucosamine 6-phosphate + CoA + H+. [EC:2.3.1.4, RHEA:10292]",2,http://amigo.geneontology.org/amigo/term/GO:0004343,2023-05-10,http://ftp.ebi.ac.uk/pub/databases/GO/goa/YEAST/goa_yeast.gaf.gz
GO:0016504,peptidase activator activity,Binds to and increases the activity of a peptidase. [GOC:ai],3,http://amigo.geneontology.org/amigo/term/GO:0016504,2023-05-10,http://ftp.ebi.ac.uk/pub/databases/GO/goa/YEAST/goa_yeast.gaf.gz
GO:0016603,glutaminyl-peptide cyclotransferase activity,Catalysis of the reaction: L-glutaminyl-peptide = 5-oxoprolyl-peptide + NH3. [EC:2.3.2.5],1,http://amigo.geneontology.org/amigo/term/GO:0016603,2023-05-10,http://ftp.ebi.ac.uk/pub/databases/GO/goa/YEAST/goa_yeast.gaf.gz
GO:0061733,peptide-lysine-N-acetyltransferase activity,Catalysis of the reaction: acetyl-CoA + lysine in peptide = CoA + N-acetyl-lysine-peptide. [GOC:dph],5,http://amigo.geneontology.org/amigo/term/GO:0061733,2023-05-10,http://ftp.ebi.ac.uk/pub/databases/GO/goa/YEAST/goa_yeast.gaf.gz
GO:0070573,metallodipeptidase activity,"Catalysis of the hydrolysis of a dipeptide by a mechanism in which water acts as a nucleophile, one or two metal ions hold the water molecule in place, and charged amino acid side chains are ligands for the metal ions. [GOC:mah, https://www.ebi.ac.uk/merops/about/glossary.shtml#CATTYPE]",2,http://amigo.geneontology.org/amigo/term/GO:0070573,2023-05-10,http://ftp.ebi.ac.uk/pub/databases/GO/goa/YEAST/goa_yeast.gaf.gz
GO:0004514,nicotinate-nucleotide diphosphorylase (carboxylating) activity,"Catalysis of the reaction: CO2 + diphosphate + nicotinate D-ribonucleotide = 5-phospho-alpha-D-ribose 1-diphosphate + 2 H+ + quinolinate. [EC:2.4.2.19, RHEA:12733]",2,http://amigo.geneontology.org/amigo/term/GO:0004514,2023-05-10,http://ftp.ebi.ac.uk/pub/databases/GO/goa/YEAST/goa_yeast.gaf.gz
GO:0050440,2-methylcitrate synthase activity,"Catalysis of the reaction: H2O + oxaloacetate + propanoyl-CoA = (2R,3S)-2-methylcitrate + CoA + H+. [RHEA:23780]",3,http://amigo.geneontology.org/amigo/term/GO:0050440,2023-05-10,http://ftp.ebi.ac.uk/pub/databases/GO/goa/YEAST/goa_yeast.gaf.gz
GO:0004378,"GDP-Man:Man1GlcNAc2-PP-Dol alpha-1,3-mannosyltransferase activity","Catalysis of the reaction: beta-D-Man-(1->4)-beta-D-GlcNAc-(1->4)-D-GlcNAc-diphosphodolichol + GDP-alpha-D-mannose = alpha-D-Man-(1->3)-beta-D-Man-(1->4)-beta-D-GlcNAc-(1->4)-D-GlcNAc-diphosphodolichol + GDP + H+. This reaction is the transfer of an alpha-D-mannosyl residue from GDP-mannose into lipid-linked oligosaccharide, forming an alpha-(1->3)-D-mannosyl-D-mannose linkage. [EC:2.4.1.132]",1,http://amigo.geneontology.org/amigo/term/GO:0004378,2023-05-10,http://ftp.ebi.ac.uk/pub/databases/GO/goa/YEAST/goa_yeast.gaf.gz
GO:0102704,"GDP-Man:Man2GlcNAc2-PP-dolichol alpha-1,6-mannosyltransferase activity","Catalysis of the reaction: GDP-alpha-D-mannose(2-) + a (mannosyl)2-(N-acetylglucosaminyl)2-diphosphodolichol <=> H+ + GDP(3-) + a (mannosyl)3-(N-acetylglucosaminyl)2-diphosphodolichol. [EC:2.4.1.257, GOC:pz]",2,http://amigo.geneontology.org/amigo/term/GO:0102704,2023-05-10,http://ftp.ebi.ac.uk/pub/databases/GO/goa/YEAST/goa_yeast.gaf.gz
GO:0004489,methylenetetrahydrofolate reductase (NAD(P)H) activity,"Catalysis of the reaction: 5-methyltetrahydrofolate + NAD(P)+ = 5,10-methylenetetrahydrofolate + NAD(P)H + H+. [EC:1.5.1.20, PMID:26872964]",4,http://amigo.geneontology.org/amigo/term/GO:0004489,2023-05-10,http://ftp.ebi.ac.uk/pub/databases/GO/goa/YEAST/goa_yeast.gaf.gz
GO:0106312,methylenetetrahydrofolate reductase NADH activity,"Catalysis of the reaction: 5-methyltetrahydrofolate + NAD + = 5,10-methylenetetrahydrofolate + NADH + H+. [RHEA:19821]",1,http://amigo.geneontology.org/amigo/term/GO:0106312,2023-05-10,http://ftp.ebi.ac.uk/pub/databases/GO/goa/YEAST/goa_yeast.gaf.gz
GO:0106313,methylenetetrahydrofolate reductase NADPH activity,"Catalysis of the reaction: 5-methyltetrahydrofolate + NADP + = 5,10-methylenetetrahydrofolate + NADPH + H+. [RHEA:19817]",2,http://amigo.geneontology.org/amigo/term/GO:0106313,2023-05-10,http://ftp.ebi.ac.uk/pub/databases/GO/goa/YEAST/goa_yeast.gaf.gz
GO:0004818,glutamate-tRNA ligase activity,Catalysis of the reaction: ATP + L-glutamate + tRNA(Glu) = AMP + diphosphate + L-glutamyl-tRNA(Glu). [EC:6.1.1.17],4,http://amigo.geneontology.org/amigo/term/GO:0004818,2023-05-10,http://ftp.ebi.ac.uk/pub/databases/GO/goa/YEAST/goa_yeast.gaf.gz
GO:0036094,small molecule binding,"Binding to a small molecule, any low molecular weight, monomeric, non-encoded molecule. [GOC:curators, GOC:pde, GOC:pm]",1,http://amigo.geneontology.org/amigo/term/GO:0036094,2023-05-10,http://ftp.ebi.ac.uk/pub/databases/GO/goa/YEAST/goa_yeast.gaf.gz
GO:0061863,microtubule plus end polymerase,Catalysis of the transfer of tubulin dimers to the plus end of a microtubule. The reaction is reversable depending on the availability of dimers. [PMID:27872152],1,http://amigo.geneontology.org/amigo/term/GO:0061863,2023-05-10,http://ftp.ebi.ac.uk/pub/databases/GO/goa/YEAST/goa_yeast.gaf.gz
GO:0001091,RNA polymerase II general transcription initiation factor binding,"Binding to a basal RNA polymerase II transcription factor, any of the factors involved in formation of the preinitiation complex (PIC) by RNA polymerase II and defined as a basal or general transcription factor. [GOC:txnOH, PMID:16858867]",1,http://amigo.geneontology.org/amigo/term/GO:0001091,2023-05-10,http://ftp.ebi.ac.uk/pub/databases/GO/goa/YEAST/goa_yeast.gaf.gz
GO:0051990,(R)-2-hydroxyglutarate dehydrogenase activity,"Catalysis of the reaction: (R)-2-hydroxyglutarate + acceptor = 2-oxoglutarate + reduced acceptor. [EC:1.1.99.39, MetaCyc:2-HYDROXYGLUTARATE-DEHYDROGENASE-RXN]",1,http://amigo.geneontology.org/amigo/term/GO:0051990,2023-05-10,http://ftp.ebi.ac.uk/pub/databases/GO/goa/YEAST/goa_yeast.gaf.gz
GO:0004750,D-ribulose-phosphate 3-epimerase activity,"Catalysis of the reaction: D-ribulose 5-phosphate = D-xylulose 5-phosphate. [EC:5.1.3.1, RHEA:13677]",3,http://amigo.geneontology.org/amigo/term/GO:0004750,2023-05-10,http://ftp.ebi.ac.uk/pub/databases/GO/goa/YEAST/goa_yeast.gaf.gz
GO:0046975,histone H3K36 methyltransferase activity,Catalysis of the reaction: S-adenosyl-L-methionine + histone H3 L-lysine (position 36) = S-adenosyl-L-homocysteine + histone H3 N6-methyl-L-lysine (position 36). This reaction is the addition of a methyl group to the lysine residue at position 36 of the histone H3 protein. [GOC:ai],3,http://amigo.geneontology.org/amigo/term/GO:0046975,2023-05-10,http://ftp.ebi.ac.uk/pub/databases/GO/goa/YEAST/goa_yeast.gaf.gz
GO:0140955,histone H3K36 trimethyltransferase activity,"Catalysis of the reaction: L-lysyl36-[histone H3] + 3 S-adenosyl-L-methionine = 3 H+ + N6,N6,N6-trimethyl-L-lysyl36-[histone H3] + 3 S-adenosyl-L-homocysteine. This reaction is the successive addition of three methyl groups to the lysine residue at position 36 of histone H3, producing histone H3K36me3. [RHEA:60324]",2,http://amigo.geneontology.org/amigo/term/GO:0140955,2023-05-10,http://ftp.ebi.ac.uk/pub/databases/GO/goa/YEAST/goa_yeast.gaf.gz
GO:0055106,ubiquitin-protein transferase regulator activity,"Binds to and modulates the activity of a ubiquitin-protein transferase, an enzyme that catalyzes the covalent attachment of ubiquitin to lysine in a substrate protein. [GOC:BHF, GOC:rl]",2,http://amigo.geneontology.org/amigo/term/GO:0055106,2023-05-10,http://ftp.ebi.ac.uk/pub/databases/GO/goa/YEAST/goa_yeast.gaf.gz
GO:0004621,glycosylphosphatidylinositol phospholipase D activity,Catalysis of the reaction: glycoprotein phosphatidylinositol + H2O = phosphatidate + glycoprotein inositol. [EC:3.1.4.50],1,http://amigo.geneontology.org/amigo/term/GO:0004621,2023-05-10,http://ftp.ebi.ac.uk/pub/databases/GO/goa/YEAST/goa_yeast.gaf.gz
GO:0050406,[acetyl-CoA carboxylase]-phosphatase activity,"Catalysis of the reaction: [acetyl-CoA carboxylase]-phosphate + H2O = [acetyl-CoA carboxylase] + phosphate. [EC:3.1.3.44, MetaCyc:ACETYL-COA-CARBOXYLASE-PHOSPHATASE-RXN]",1,http://amigo.geneontology.org/amigo/term/GO:0050406,2023-05-10,http://ftp.ebi.ac.uk/pub/databases/GO/goa/YEAST/goa_yeast.gaf.gz
GO:0110050,deaminated glutathione amidase activity,"Catalysis of the reaction: N-(4-oxoglutarate)-L-cysteinylglycine + H2O = 2-oxoglutarate + L-cysteinylglycine. [GOC:ka, PMID:28373563, RHEA:54532]",1,http://amigo.geneontology.org/amigo/term/GO:0110050,2023-05-10,http://ftp.ebi.ac.uk/pub/databases/GO/goa/YEAST/goa_yeast.gaf.gz
GO:0032216,glucosaminyl-phosphatidylinositol O-acyltransferase activity,Catalysis of the reaction: glucosaminyl-phosphatidylinositol + fatty acyl-CoA = glucosaminyl-acyl-phasphotidylinositol + CoA. [Reactome:R-HSA-162683],3,http://amigo.geneontology.org/amigo/term/GO:0032216,2023-05-10,http://ftp.ebi.ac.uk/pub/databases/GO/goa/YEAST/goa_yeast.gaf.gz
GO:0070182,DNA polymerase binding,"Binding to a DNA polymerase. [GOC:BHF, GOC:mah]",1,http://amigo.geneontology.org/amigo/term/GO:0070182,2023-05-10,http://ftp.ebi.ac.uk/pub/databases/GO/goa/YEAST/goa_yeast.gaf.gz
GO:0015485,cholesterol binding,"Binding to cholesterol (cholest-5-en-3-beta-ol); the principal sterol of vertebrates and the precursor of many steroids, including bile acids and steroid hormones. [GOC:jl, ISBN:0198506732]",1,http://amigo.geneontology.org/amigo/term/GO:0015485,2023-05-10,http://ftp.ebi.ac.uk/pub/databases/GO/goa/YEAST/goa_yeast.gaf.gz
GO:0019211,phosphatase activator activity,Binds to and increases the activity of a phosphatase. [GOC:ai],3,http://amigo.geneontology.org/amigo/term/GO:0019211,2023-05-10,http://ftp.ebi.ac.uk/pub/databases/GO/goa/YEAST/goa_yeast.gaf.gz
GO:0061775,cohesin loader activity,"Facilitating a conformational change to load a cohesin complex around sister chromatids, driven by ATP hydrolysis. [GOC:vw, PMID:26687354]",1,http://amigo.geneontology.org/amigo/term/GO:0061775,2023-05-10,http://ftp.ebi.ac.uk/pub/databases/GO/goa/YEAST/goa_yeast.gaf.gz
GO:0016799,"hydrolase activity, hydrolyzing N-glycosyl compounds",Catalysis of the hydrolysis of any N-glycosyl bond. [GOC:jl],1,http://amigo.geneontology.org/amigo/term/GO:0016799,2023-05-10,http://ftp.ebi.ac.uk/pub/databases/GO/goa/YEAST/goa_yeast.gaf.gz
GO:0001727,lipid kinase activity,Catalysis of the phosphorylation of a simple or complex lipid. [GOC:hjd],3,http://amigo.geneontology.org/amigo/term/GO:0001727,2023-05-10,http://ftp.ebi.ac.uk/pub/databases/GO/goa/YEAST/goa_yeast.gaf.gz
GO:0017050,D-erythro-sphingosine kinase activity,Catalysis of the reaction: sphingosine + ATP = sphingosine 1-phosphate + ADP. [MetaCyc:RXN3DJ-11417],5,http://amigo.geneontology.org/amigo/term/GO:0017050,2023-05-10,http://ftp.ebi.ac.uk/pub/databases/GO/goa/YEAST/goa_yeast.gaf.gz
GO:0016979,lipoate-protein ligase activity,"Catalysis of the lipoylation of a protein in two steps: ATP + (R)-lipoate + a [lipoyl-carrier protein]-L-lysine = a [lipoyl-carrier protein]-N6-(lipoyl)lysine + AMP + diphosphate (overall reaction): (1) ATP + (R)-lipoate = lipoyl-AMP + diphosphate; (2) lipoyl-AMP + a [lipoyl-carrier protein]-L-lysine = a [lipoyl-carrier protein]-N6-(lipoyl)lysine + AMP. [PMID:16141198, PMID:17570395, RHEA:49288]",1,http://amigo.geneontology.org/amigo/term/GO:0016979,2023-05-10,http://ftp.ebi.ac.uk/pub/databases/GO/goa/YEAST/goa_yeast.gaf.gz
